{
  "$schema": "https://json-schema.org/draft/2020-12/schema",
  "$id": "action.schema.json",
  "title": "Action Contract",
  "type": "object",
  "required": ["id", "inputs", "preconditions", "sideEffects", "failure"],
  "additionalProperties": false,
  "properties": {
    "id": { "type": "string", "pattern": "^action\\.[a-z0-9-]+$" },
    "title": { "type": "string" },
    "inputs": { "type": "array", "items": { "type": "string" } },
    "preconditions": { "type": "array", "items": { "type": "string" } },
    "permission": { "type": "string" },
    "idempotent": { "type": "boolean" },
    "sideEffects": { "type": "array", "items": { "type": "string" } },
    "failure": { "type": "string" }
  }
}
